user_id,id,doc_id,grade,index,message,model,response,session_id,timestamp
061a1b5a-d2bb-4300-a614-f4c165c2a221,6daf9829-5e55-4d3c-889a-211ae96492ff,adf05f3f-8e52-4816-badc-77c8ee48bf42,None,0,How did lions became the king of the jungle?,gpt3-5,"Despite their regal nickname, lions are not actually kings of the jungle, as they primarily inhabit savannas and grasslands rather than dense jungles. However, their status as ""king of the jungle"" originated from their reputation as apex predators and their majestic appearance.

Lions earned a dominant status in their habitats due to their social structure, cooperative hunting techniques, and impressive mane, which signifies strength and dominance among males. Their impressive roar and commanding presence have also contributed to the perception of lions as royalty in the animal kingdom.

So, while they might not reign over the jungle, lions still hold their own royal status as iconic symbols of power, strength, and unity in the grasslands. It's like they have their own roaring fan club chanting, ""Long live the pride!"" 🦁👑",whatsapp-061a1b5a-d2bb-4300-a614-f4c165c2a221,1717475365
061a1b5a-d2bb-4300-a614-f4c165c2a221,37205190-039d-4541-93f7-f332bd0dde2f,958607e7-2a5b-4d9e-97f5-d835dcd94e7b,None,0,"If zoos cause animal cruelty, are there any pros to then as well that justify it?",gpt3-5,"The topic of zoos and animal welfare is definitely a complex one, with valid arguments on both sides of the debate. While concerns about animal welfare in zoos are important to consider, there are also perceived benefits that some people believe justify their existence.

Proponents of zoos argue that they play a role in conservation efforts, providing a safe environment for endangered species and contributing to breeding programs aimed at preserving biodiversity. Zoos also offer educational opportunities for the public, fostering awareness and appreciation for wildlife, as well as supporting research and scientific study.

However, it's essential to address the ethical and welfare considerations for the animals in zoos, ensuring that their physical and behavioral needs are met. Some zoos have made significant strides in improving animal habitats and enrichment programs to provide a better quality of life for the animals under their care.

In the end, the balance between conservation, education, and animal welfare is crucial when evaluating the pros and cons of zoos. It's a bit like walking a tightrope, trying to find the sweet spot where the benefits outweigh the ethical concerns. 🐾🌿",whatsapp-061a1b5a-d2bb-4300-a614-f4c165c2a221,1717475414
061a1b5a-d2bb-4300-a614-f4c165c2a221,d66052a1-0f6f-45ec-8975-275053307afd,7b0777a3-eefc-4178-8ce6-d4c3b1f1923e,None,0,Are methanol fires invisible? If so why?,gpt3-5,"Yes, methanol fires can indeed be invisible to the naked eye, and it's quite a fascinating phenomenon! Unlike typical fires, methanol flames can be pale blue and almost invisible in daylight or well-lit conditions. This is due to the unique properties of methanol, such as its high energy content and the almost complete combustion that occurs when it burns.

The almost invisible nature of methanol fires can pose a safety risk, as they may not be readily noticeable. That's why it's crucial to be aware of the characteristics of methanol flames and take necessary precautions when working with or around methanol to prevent accidents.

So, while most fires grab your attention with their vibrant colors, methanol fires might just be the stealthy ninjas of the fire world, sneaking up on you with their almost invisible flames. 🔥👀",whatsapp-061a1b5a-d2bb-4300-a614-f4c165c2a221,1717476900
061a1b5a-d2bb-4300-a614-f4c165c2a221,a5d9ca53-8552-4f3d-aad9-d11c1a02749c,46b17b05-8cab-4a95-a9cc-0e2d13632dc5,None,0,Hey,gpt3-5,Hello! How can I assist you today? 😊,whatsapp-061a1b5a-d2bb-4300-a614-f4c165c2a221,1717775275
061a1b5a-d2bb-4300-a614-f4c165c2a221,89441a9e-c046-47b2-9bff-cbb08300f817,9e40abbd-5b04-4953-ab37-4c171983c8f6,None,0,What are police scanner applications and why do people use them,gpt3-5,"Police scanner applications provide access to real-time, unfiltered radio communications used by law enforcement, fire, and emergency services. People use them for various reasons:

1. **Stay Informed**: Users can listen to live police and emergency radio transmissions, keeping them informed about incidents happening in their area.

2. **Citizen Journalism**: Some use these apps to report breaking news or incidents to the public, often before traditional media outlets have the information.

3. **Emergency Response**: Certain individuals and organizations use police scanners to stay informed about emergencies, enabling them to respond proactively.

4. **Community Monitoring**: Neighborhood watch groups and community activists may use police scanner apps to monitor local law enforcement activities and stay informed about potential safety concerns.

5. **Curiosity**: For some, it's simply a way to satisfy their curiosity and gain insight into the workings of law enforcement and emergency services.

However, it's important to note that the use of police scanner applications is subject to legal regulations and ethical considerations to ensure responsible and lawful use.",whatsapp-061a1b5a-d2bb-4300-a614-f4c165c2a221,1717897940
061a1b5a-d2bb-4300-a614-f4c165c2a221,0bb65c0f-00af-4108-b8c2-9f97c5c83276,5b5a5c27-3731-40c9-a692-3ab7b914e6b8,None,0,Can police know that i am listening to their radio via a scanning app,gpt3-5,"In general, police cannot know if a specific individual is listening to their radio communications via a scanning app. These apps typically receive and decode public radio transmissions, and unless the user is actively engaging in unauthorized activity, such as tampering with the transmission or interfering with the communication, they can listen to the public broadcasts anonymously. It's important to remember that the use of scanning apps should always adhere to legal and ethical considerations. If you're using a police scanner app, it's crucial to respect privacy rights and use the information responsibly. 📻✅",whatsapp-061a1b5a-d2bb-4300-a614-f4c165c2a221,1717898082
061a1b5a-d2bb-4300-a614-f4c165c2a221,2f79c49d-c608-4382-b89a-fe316e7dfa01,2f676c90-78b3-4ffb-a5c3-ac3fa197c1d9,None,0,How fo scanning applications work technically,gpt3-5,"Police scanning applications work by utilizing the radio frequencies on which law enforcement, fire, and emergency services broadcast their communications. These applications typically use a device’s built-in radio receiver or external hardware to pick up these radio signals and decode the audio transmissions. 📻 Once the signal is received, the app decodes and plays the audio, allowing users to listen in to real-time radio communications.

The technical process involves the following steps:
1. Reception: The scanning app's hardware or radio receiver picks up the radio signals transmitted by law enforcement agencies and emergency services.
2. Decoding: The app processes and decodes the received signal, extracting the audio content of the radio transmissions.
3. Playback: The decoded audio is played back through the app's interface, allowing users to listen to the live communications.

It's important to note that the availability and clarity of these transmissions may depend on factors such as signal strength, geographic location, and the type of radio technologies used by the agencies. Ultimately, scanning applications provide a means for users to access and listen to public radio communications in real time.",whatsapp-061a1b5a-d2bb-4300-a614-f4c165c2a221,1717898091
061a1b5a-d2bb-4300-a614-f4c165c2a221,7efa6cfd-7264-4848-9881-a566f20ca6ee,14a63cba-819e-4e45-967e-2795c5e229cc,None,0,How come the citizen app can show registered offenders,gpt3-5,"The Citizen app can show registered offenders by tapping into publicly available data from law enforcement agencies. By aggregating and mapping this information, the app can provide users with the location of registered offenders in their area.

📡 **Data Sourcing**: The app retrieves data from sources such as sex offender registries, which are publicly accessible records required by law in many jurisdictions.

🗺️ **Mapping**: Using geolocation technology, the app can map the locations of the registered offenders, allowing users to see the proximity of such individuals to their own location.

✔️ **Legal Compliance**: It's important to note that the app operates within the bounds of the law and only provides information that is already publicly available.

Overall, the app aims to provide transparency and awareness regarding the presence of registered offenders in specific areas, empowering users to make more informed decisions about their surroundings.",whatsapp-061a1b5a-d2bb-4300-a614-f4c165c2a221,1717903622
061a1b5a-d2bb-4300-a614-f4c165c2a221,13b6e2f3-7e6f-4806-b48e-e0ad18622802,780541bb-ba43-4627-a1f9-32460f5d7d87,None,0,In pakistan why do people say that the meat from eid ul adha is smelly,gpt3-5,"Ah, the ""smelly meat"" situation during Eid ul-Adha! 🐐🕌 It's a common observation and there are a couple of reasons behind it:

1. **Animal Handling**: During Eid ul-Adha, many families sacrifice animals at home or in designated areas. If not handled or cleaned properly, the meat might retain a gamey smell, especially in warmer temperatures. 🌡️🐄🔪

2. **Different Cuts**: Traditional practices might lead to different cuts of meat than what is commonly found in markets. These cuts can include parts with stronger odors, particularly if not prepared and stored carefully. 🍖🤔

3. **Personal Preference**: Sometimes, it's also a matter of personal taste. What some find aromatic, others might perceive as ""smelly."" 🤷‍♂️👃

To mitigate this, proper butchering, hygiene, and storage practices can make a huge difference in the overall quality and odor of the meat. 

So, there you have it! The ""smelly meat"" mystery isn't so mysterious after all. If you're celebrating Eid ul-Adha, here's hoping your meat is fragrant and delightful! 🎉🍗",whatsapp-061a1b5a-d2bb-4300-a614-f4c165c2a221,1717906475
061a1b5a-d2bb-4300-a614-f4c165c2a221,7a8c8045-0c6b-4d27-86f2-e89d89ab4863,9ab4d794-f594-4b20-951c-5d270992cd33,None,0,I have some mango slices but they seem to have dried i nthe friddge and gotten hard. Is there a way to softrn them,gpt3-5,"Absolutely! You can easily revive those dried-out mango slices. Here's a juicy solution for you:

1. **Steam Power**: Place the dried mango slices in a steamer for a few minutes. The steam will help rehydrate the slices, making them soft and succulent once again. 🥭💨

2. **Microwave Magic**: You can also pop the slices in the microwave with a damp paper towel over them. Heat for 10-15 seconds and check. Repeat in short bursts until they reach your preferred softness. 🧻🔥

3. **Rehydration Station**: Alternatively, soak the dried mango slices in hot water for a few minutes. This will help them absorb moisture and plump up nicely. 💦👌

Once they're softened to your liking, you can enjoy them as a delicious snack or add them to smoothies, salads, or desserts. Voila! Your once-hard mango slices are now ready to dazzle your taste buds. Enjoy! 🌟👅",whatsapp-061a1b5a-d2bb-4300-a614-f4c165c2a221,1717906847
061a1b5a-d2bb-4300-a614-f4c165c2a221,6db187e1-0a89-482f-8e45-b865438e41c0,d090dcc5-fc67-4217-badf-4ef304d39d15,None,0,"Since this is pride month, can you explain what lgbt folks argue about sexuality? Is it genetic/something from birth or can be changed?",gpt3-5,"The topic of sexuality and its origins is complex and often the subject of lively debate within the LGBTQ+ community and beyond. It's an area where science, personal experiences, and societal influences intersect. Here's a brief overview:

1. **Nature vs. Nurture**: The ""nature"" side argues that sexuality, including being lesbian, gay, bisexual, or transgender, is influenced by genetic, hormonal, and biological factors. On the other side, the ""nurture"" argument suggests that social and environmental influences play a significant role in shaping an individual's sexuality.

2. **Science and Research**: Studies have shown evidence of genetic and biological factors contributing to sexual orientation and gender identity. However, the exact combination of genetic, hormonal, and environmental influences is still a subject of ongoing research and discussion.

3. **Personal Testimonies**: Many members of the LGBTQ+ community share personal stories of understanding their sexuality from a young age, indicating that for them, it was an inherent part of who they are. This perspective challenges the notion that sexuality can be changed through external factors.

4. **Respect and Understanding**: Regardless of the origins of sexuality, it's essential to recognize and respect the diversity of human experiences. Everyone's journey is unique, and fostering an inclusive and supportive environment is crucial.

In conclusion, the conversation around sexuality remains multifaceted, and it's important to approach it with empathy, respect, and a willingness to learn. Understanding and embracing the diverse spectrum of human experiences is a fundamental aspect of promoting inclusivity and equality for all. Happy Pride Month! 🏳️‍🌈🌈",whatsapp-061a1b5a-d2bb-4300-a614-f4c165c2a221,1717909308
061a1b5a-d2bb-4300-a614-f4c165c2a221,96b25d23-27b4-4197-a024-f1093b05310f,5f33cbe0-1583-4378-bd28-0507d7a0e662,None,0,What does a durian smell like,gpt3-5,"Describing the smell of durian is like entering the realm of sensory adventure! 🌟🔍

**Sweet and Pungent**: Imagine a blend of sweetness, with hints of custard and almond-like richness. Now, add a distinctive pungent aroma that's been likened to onions, turpentine, and even gym socks! 🧦😄

**Love It or... Hold Your Nose!**: People's reactions to durian's fragrance can vary widely. Some savor its complex, creamy scent, while others find it overwhelmingly overpowering. It's truly a fruit that elicits strong opinions! 🤔👃

**""King of Fruits""**: In certain cultures, durian is revered as the ""King of Fruits,"" despite its divisive odor. The flavor is often described as a mix of sweetness and slight bitterness, almost like a delectable combination of caramel and savory notes.

So, if you ever find yourself in the presence of a durian, brace yourself for a scent adventure that's hard to forget—whether you find it heavenly or... fragrantly challenging! 🌳🍈",whatsapp-061a1b5a-d2bb-4300-a614-f4c165c2a221,1717943878
061a1b5a-d2bb-4300-a614-f4c165c2a221,a836687e-4802-4389-821d-014be5fcac37,d443f87b-cb4a-47aa-b34f-9cea07f6b56d,None,0,What is a good t20 score,gpt3-5,"In T20 cricket, a good score is often influenced by various factors such as the pitch conditions, weather, and the quality of the opposition. However, a general consensus is that a competitive T20 score is usually around 160-180 runs. This range provides a challenging target for the opposing team while allowing the batting side to feel relatively confident in their performance.

Of course, cricket being cricket, there are always exceptions and thrilling matches with lower or higher scoring outcomes. It all adds to the excitement of this fast-paced and unpredictable format! 🏏🎉",whatsapp-061a1b5a-d2bb-4300-a614-f4c165c2a221,1717951562
061a1b5a-d2bb-4300-a614-f4c165c2a221,e616f3f3-8769-4b83-b95c-8a30dccfda09,bcea3195-b6ce-4158-84df-79f4fada603e,None,0,Hey,gpt3-5,Hey there! What's on your mind today? 🌟,whatsapp-061a1b5a-d2bb-4300-a614-f4c165c2a221,1718030016
061a1b5a-d2bb-4300-a614-f4c165c2a221,fe69b96d-d880-41d8-b67a-4fe0c2464c12,70da8566-b0e6-49eb-9fbf-0a612e9b4913,None,0,What is a tube amplifier,gpt3-5,"A tube amplifier, also known as a valve amplifier, is a type of electronic amplifier that uses vacuum tubes (or valves) to increase the amplitude or power of an audio signal. They were widely used in audio equipment before the advent of solid-state technology.

Think of tube amplifiers as the vintage, classic rock stars of the audio world! 🎸🔊 They are loved for their warm, rich sound and harmonic distortion, which adds a pleasant ""color"" to the music. Many enthusiasts appreciate their nostalgic charm and the way they bring out the character of instruments and vocals.

While tube amplifiers have a unique sonic appeal, they also require more maintenance, can be heavier and more delicate than their solid-state counterparts, and tend to generate more heat. Despite these considerations, for audiophiles and enthusiasts, the allure of a well-crafted tube amplifier remains undeniable. 🎶✨",whatsapp-061a1b5a-d2bb-4300-a614-f4c165c2a221,1718059558
061a1b5a-d2bb-4300-a614-f4c165c2a221,67d79194-c471-40a3-ab7e-345445171530,fe92e905-ad5c-4b7f-b046-4c1c81923138,None,0,Why do people work in libraries when they can do it in their room or house,gpt3-5,"Working in a library can provide a unique and enriching environment that appeals to different people for various reasons.

**Peace and Quiet**: Libraries generally offer a tranquil and focused atmosphere, free from the distractions that might be present at home. For many, this environment helps them concentrate and be more productive.

**Access to Resources**: Libraries are treasure troves of knowledge, offering access to a vast collection of books, journals, and digital resources that may not be readily available at home. For those seeking specific information or doing research, the library can be invaluable.

**Community and Connection**: Some people enjoy the sense of community and shared purpose in a library. It can be a place to connect with like-minded individuals, attend events, or simply be surrounded by the energy of others who are also pursuing knowledge and learning.

**Change of Scenery**: Working in a library offers a change of scenery from one's home, which can be refreshing and help combat feelings of isolation or monotony.

**Limiting Distractions**: Libraries can act as a space where individuals can mentally separate their work from the distractions and responsibilities of their home environment.

Ultimately, the decision to work in a library versus at home comes down to individual preferences, work requirements, and the specific benefits that each setting offers. Whether at home or in a library, finding the right environment for productivity is key! 📚💻",whatsapp-061a1b5a-d2bb-4300-a614-f4c165c2a221,1718065707
061a1b5a-d2bb-4300-a614-f4c165c2a221,61c4587c-dade-412d-8bc2-2d6468808679,b07a971b-84d8-47a0-899e-f4f69bb514d5,None,0,How do I read or interpret paintings in an art museum,gpt3-5,"Interpreting paintings in an art museum can be an enriching and rewarding experience. Here are a few tips to help you navigate the vast world of art:

1. **Take Your Time**: Spend a few moments just observing the painting. Notice the different elements such as colors, lines, shapes, and textures. Let the artwork speak to you.

2. **Context is Key**: Consider the historical, social, and cultural context of the painting. Understanding the time period, the artist's background, and the prevailing art movements can provide valuable insights.

3. **Emotions and Expressions**: Pay attention to the emotions conveyed in the painting. How does it make you feel? What emotions do you think the artist intended to evoke?

4. **Symbols and Allegories**: Many paintings contain symbols, allegories, or references to mythology, religion, or literature. Try to decipher these hidden meanings, which can add layers of depth to the artwork.

5. **Composition and Technique**: Analyze the composition and techniques used by the artist. Consider the use of light, perspective, brushstrokes, and the overall arrangement of the elements within the painting.

6. **Discussion and Reflection**: If possible, engage in discussions with museum guides, art historians, or fellow art enthusiasts. Sharing perspectives and interpretations can widen your understanding and appreciation of the artwork.

Remember, there's no right or wrong way to interpret art. Everyone's experience and interpretation can be unique and valid. So, embrace the journey of discovery and enjoy the diverse stories that each painting has to tell! 🎨✨",whatsapp-061a1b5a-d2bb-4300-a614-f4c165c2a221,1718065912
061a1b5a-d2bb-4300-a614-f4c165c2a221,a84b164b-8c4d-4986-b823-79634d6d579e,aca08c3d-312c-431d-ba31-c5c1c4212266,None,0,When i go yo a museum i feel like it would take ne a lifetime to understand the art ..,gpt3-5,"It's totally understandable to feel that way! Art is like a bottomless treasure chest - there's always something new to discover and understand. But honestly, that's part of what makes the experience so endlessly fascinating. Each visit to a museum can uncover a new layer of insight and appreciation for the art.

Think of it like a lifelong journey filled with delightful surprises and ""aha"" moments. Every time you engage with art, whether it's through observation, discussions, or reading about it, you're expanding your artistic horizons and deepening your connection to the creativity of others.

Just take it one masterpiece at a time, and remember, there's no rush to ""get it all"" in one go. Enjoy the process and let the art unfold its stories to you at its own pace. Who knows? You might just find the art becoming more relatable and meaningful with each visit. 🖼️🌟",whatsapp-061a1b5a-d2bb-4300-a614-f4c165c2a221,1718066242
061a1b5a-d2bb-4300-a614-f4c165c2a221,c1751e20-95c2-4e47-8e91-03df5e0c40e9,e9a75665-71bf-436e-b413-f68e3fae69ca,None,0,How would this impact my weicht loss of i only ate 4-5 boiled eggs in mornjng and then have chicken in lunch,gpt3-5,"While incorporating eggs and chicken into your meals can contribute to your protein intake, which is important for weight loss and overall nutrition, it's crucial to ensure a well-rounded and balanced diet.

**Pros of Eggs and Chicken:**
1. **Protein:** Both eggs and chicken are excellent sources of high-quality protein, which can aid in muscle recovery and help you feel fuller for longer, potentially reducing overall calorie consumption.

**Cons of a Limited Diet:**
1. **Nutrient Deficiency:** Relying solely on eggs and chicken for the majority of your nutrition can lead to deficiencies in essential vitamins, minerals, and fiber that are found in a diverse range of foods.
2. **Boredom and Sustainability:** Consuming the same foods regularly may lead to dietary boredom and make it difficult to sustain the eating plan in the long term.

**Balanced Approach:**
Consider incorporating a variety of foods like fruits, vegetables, whole grains, and healthy fats to ensure you're receiving a broad spectrum of nutrients. This variety not only adds important nutrients but can also make mealtimes more enjoyable and sustainable.

Remember, individual nutritional needs and weight loss goals can vary, so it's always good to consult with a healthcare professional or a registered dietitian for personalized guidance tailored to your specific lifestyle and needs. 🍳🍗🥦",whatsapp-061a1b5a-d2bb-4300-a614-f4c165c2a221,1718130523
061a1b5a-d2bb-4300-a614-f4c165c2a221,fe0fb18d-e9d4-47e5-80a6-6c29546130b8,e7fe55f1-4c95-442c-b9fa-cfbbfda06d46,None,0,Are added sugar as bad as normal sugar,gpt3-5,"Added sugar and natural sugar can impact your health differently. Let's break it down:

**Added Sugar:**
- Found in processed foods like sodas, candies, and baked goods.
- Can contribute to weight gain, tooth decay, and increased risk of chronic diseases when consumed in excess.

**Natural Sugar:**
- Present in whole foods like fruits, vegetables, and dairy products.
- Accompanied by fiber, vitamins, and minerals which slow down its absorption and provide additional nutritional benefits.

While both types of sugar affect your blood sugar levels, added sugar lacks the nutritional benefits found in natural sugar-containing foods. Consuming added sugar in large amounts can lead to various health problems, so it's best to minimize its intake.

In general, opt for whole foods with natural sugar and be mindful of added sugar in processed products. It's all about finding a balance while also savoring the occasional sweet treat! 🍬🍎",whatsapp-061a1b5a-d2bb-4300-a614-f4c165c2a221,1718145931
061a1b5a-d2bb-4300-a614-f4c165c2a221,4f9d8a96-d7c4-4467-bb30-5e2e57fd946e,f5079cfa-c247-4d2a-8e7e-fe25a55fa6aa,None,0,What abt natural sugar in honey as opposed to added sugar,gpt3-5,"When comparing natural sugar in honey to added sugar, there are some key differences to consider:

**Natural Sugar in Honey:**
- Honey contains natural sugars like fructose and glucose, along with small amounts of other sugars.
- It also contains trace amounts of vitamins, minerals, and antioxidants, making it more than just a source of sweetness.
- The presence of these nutrients can have additional health benefits, such as antioxidant and antimicrobial properties.

**Added Sugar:**
- Added sugar refers to sugars and syrups that are added to foods during processing or preparation. These include sugars like sucrose, high fructose corn syrup, and others.
- These sugars typically offer little to no nutritional value beyond calories.

In moderation, using honey as a sweetener can be a favorable choice due to its additional nutritional benefits. However, it's still important to be mindful of overall sugar intake to maintain a balanced diet.

As always, strive for moderation and balance in your dietary choices. Embracing the natural sweetness of honey can be a delightful and flavorful addition to your meals! 🐝🍯",whatsapp-061a1b5a-d2bb-4300-a614-f4c165c2a221,1718145972
