user_id,id,doc_id,grade,index,message,model,response,session_id,timestamp
de9b616e-e193-45c8-a7bb-8da123d0b6c2,39f06f62-9cba-424e-b895-7145ab93b4c3,dad91ef9-52bb-4e92-85a9-c9b5459de738,None,0,Test,gpt3-5,Looks like you're running another test! Let me know if there's anything specific you'd like to learn or explore. I'm here to help.,whatsapp-de9b616e-e193-45c8-a7bb-8da123d0b6c2,1716212884
de9b616e-e193-45c8-a7bb-8da123d0b6c2,0c1df81e-7dcf-4049-a61f-4e0e8e7b6516,21e1f795-afa5-4f39-ab94-d271988fe998,None,0,Test,gpt3-5,"Seems like we're testing the waters! If there's anything specific you'd like to know, just give me a shout.",whatsapp-de9b616e-e193-45c8-a7bb-8da123d0b6c2,1716304003
de9b616e-e193-45c8-a7bb-8da123d0b6c2,89571842-1f08-4b51-b6c0-06c8f764ffb4,f00c3bb2-9e89-469a-b31c-171665b70669,None,0,Test,gpt3-5,"It seems like we're on a testing spree today! If there's a specific feature or topic that you'd like to explore, just let me know. I'm here to assist!",whatsapp-de9b616e-e193-45c8-a7bb-8da123d0b6c2,1716304655
de9b616e-e193-45c8-a7bb-8da123d0b6c2,101c285b-4b48-41d1-b2c9-ca09d9430cd5,36c24770-e8bb-47aa-bd3f-46da5c461fed,None,0,Test,gpt3-5,Seems like the testing bug has bitten again! Let me know if there's something specific you'd like to dive into.,whatsapp-de9b616e-e193-45c8-a7bb-8da123d0b6c2,1716305037
de9b616e-e193-45c8-a7bb-8da123d0b6c2,ade0ba6c-8e53-4e08-b982-b622b0f32111,b2575e33-1ddc-4ef0-83fa-a3c7c8f7f6b3,None,0,Test,gpt3-5,"Seems like we're stuck in a testing loop! If you need assistance with anything, feel free to ask. I'm here to help!",whatsapp-de9b616e-e193-45c8-a7bb-8da123d0b6c2,1716305258
de9b616e-e193-45c8-a7bb-8da123d0b6c2,9485209c-f11a-4fe5-aafc-067d432e24a5,087057b6-ad5e-48d5-96b0-1eeb29fddcc0,None,0,Test,gpt3-5,"Looks like we're on a testing marathon today! If you need any assistance beyond testing, feel free to ask. I'm more than just a test subject!",whatsapp-de9b616e-e193-45c8-a7bb-8da123d0b6c2,1716391171
de9b616e-e193-45c8-a7bb-8da123d0b6c2,6599ddab-8ca3-4ec4-a4a0-14b7b379d583,f9a2d655-ce8f-4d81-bf3e-cdce55621bc6,None,0,Test,gpt3-5,"It's all about that testing life, huh? If there's something specific you're curious about or need help with, just give me a shout!",whatsapp-de9b616e-e193-45c8-a7bb-8da123d0b6c2,1716392320
de9b616e-e193-45c8-a7bb-8da123d0b6c2,c0d6e0dd-d2ea-488b-9470-9c6df116feed,906e6c67-f565-4656-8831-9e05e69429b2,None,0,Test,gpt3-5,"Looks like we're in test mode! If you've got any specific questions or need help with something, fire away!",whatsapp-de9b616e-e193-45c8-a7bb-8da123d0b6c2,1716392481
de9b616e-e193-45c8-a7bb-8da123d0b6c2,69a7ebec-9bb2-442e-9bcb-a646e842fb20,bcad5d9d-1a80-4467-a2eb-0d020f8aec10,None,0,Test,gpt3-5,"Testing 1, 2, 3... Is this thing on? If you need any assistance or have questions, I'm here for you!",whatsapp-de9b616e-e193-45c8-a7bb-8da123d0b6c2,1716392593
de9b616e-e193-45c8-a7bb-8da123d0b6c2,40ddf72e-6ba8-4603-b7bd-7235831969b5,84beb700-9577-4a8c-ab33-40fd9133cb67,None,0,Hi,gpt3-5,Hey there! What's on your mind today?,whatsapp-de9b616e-e193-45c8-a7bb-8da123d0b6c2,1716392600
de9b616e-e193-45c8-a7bb-8da123d0b6c2,8bce799f-957c-4331-beb8-2c5cc84c5cd7,d932b467-933f-47d8-8546-ae4ed84a51e6,None,0,Just testing,gpt3-5,"Testing, testing, 1, 2, 3... Sounds like you've got the testing bug! Let me know if there's anything specific you'd like to explore or discuss.",whatsapp-de9b616e-e193-45c8-a7bb-8da123d0b6c2,1716392615
de9b616e-e193-45c8-a7bb-8da123d0b6c2,ebdfb69b-1916-459f-807b-54c3ce469707,1bc929b2-297b-4e31-be3f-432b9b8f9114,None,0,Who was the first president?,gpt3-5,The first president of the United States was George Washington. 🇺🇸,whatsapp-de9b616e-e193-45c8-a7bb-8da123d0b6c2,1716392629
de9b616e-e193-45c8-a7bb-8da123d0b6c2,77bb2ed2-f03f-40ee-8da1-490be30dcb45,93c8a5a0-8fae-4dfa-9fba-7340e1a7f2f7,None,0,Hi there,gpt3-5,"Well, hello! How can I assist you today?",whatsapp-de9b616e-e193-45c8-a7bb-8da123d0b6c2,1716392703
de9b616e-e193-45c8-a7bb-8da123d0b6c2,f3bf4113-ada3-4824-9d33-e7ffd24f790a,afeb8931-c2ae-4b40-81ac-a7592507d4be,None,0,Test,gpt3-5,Looks like we've got a live one! What are we testing today?,whatsapp-de9b616e-e193-45c8-a7bb-8da123d0b6c2,1718895928
de9b616e-e193-45c8-a7bb-8da123d0b6c2,ae694e66-f3c3-4a17-ab40-9319bf10de22,3ad8defa-c7fc-4b0a-a1fa-12c68eeebae1,None,0,Hi,gpt3-5,Hey there! What's on your mind today?,whatsapp-de9b616e-e193-45c8-a7bb-8da123d0b6c2,1718896081
de9b616e-e193-45c8-a7bb-8da123d0b6c2,75a803d3-19e0-44e3-85d6-46ceb30354f5,d149c882-e6e0-4a6d-955d-7a8672e5fade,None,0,Test,gpt3-5,"🔍 Test

It seems like the word ""test"" is a recurring theme here. If there's a specific test you'd like to discuss or any other topic you need help with, just let me know!",whatsapp-de9b616e-e193-45c8-a7bb-8da123d0b6c2,1718896091
4dd06632-c4b4-4690-a0af-ef5340212821,03eac1ce-8e18-45fe-a8cc-975e8749727c,96328474-7265-4d93-b063-618768805977,None,0,How can I increase my toddler's social skills,gpt3-5,"Encouraging your toddler's social skills is a great way to set them up for success. 🌟 Here are a few fun and effective tips:
1. Playdates: Arrange playdates with other toddlers to help them interact and engage in social activities.
2. Role-playing: Use toys or puppets to act out different social scenarios and teach them about sharing and taking turns.
3. Storytime: Reading books about friendships and emotions can help them understand social interactions.
4. Outdoor activities: Take them to the park or playground to interact with other children and learn to navigate social dynamics in a natural setting.
5. Positive reinforcement: Praise their efforts when they interact positively with others to boost their confidence.

Remember, every child is unique, so be patient and celebrate their progress along the way! 🌈",whatsapp-4dd06632-c4b4-4690-a0af-ef5340212821,1717426519
4dd06632-c4b4-4690-a0af-ef5340212821,5d54016c-5e80-4810-ab44-2109af207c01,a2e20301-9fb4-4081-bfa9-9a188a58ff4d,None,0,Horse son,gpt3-5,"It sounds like you might be referring to a ""horse-son"" or maybe it's a typo, but if you'd like to share more information, I'm here to help! 🐴👦",whatsapp-4dd06632-c4b4-4690-a0af-ef5340212821,1717459139
4dd06632-c4b4-4690-a0af-ef5340212821,5d86a82c-97cf-41a4-834e-07def5833ee4,25ceb9d3-ba24-4fa7-be5b-6d95c8aa9c96,None,0,What do you call a horse's baby,gpt3-5,"A baby horse is called a ""foal""! They're absolutely adorable and have a unique charm of their own. 🐴✨",whatsapp-4dd06632-c4b4-4690-a0af-ef5340212821,1717459162
4dd06632-c4b4-4690-a0af-ef5340212821,6d5a7b4b-6880-4adf-b3b8-99eb43d1a827,15430f84-711f-4117-8f54-d02ef14e2962,None,0,Pronunciation,gpt3-5,"Sure! ""Foal"" is pronounced as ""fohl."" It rhymes with ""coal."" 🐴👶",whatsapp-4dd06632-c4b4-4690-a0af-ef5340212821,1717459171
4dd06632-c4b4-4690-a0af-ef5340212821,ce6db09e-a332-4a27-ac30-0bb05ab10b92,d524afe6-821d-4548-a031-71be4d57c922,None,0,Thanks,gpt3-5,"You're welcome! If you have any more questions, feel free to ask. 😊",whatsapp-4dd06632-c4b4-4690-a0af-ef5340212821,1717459210
4dd06632-c4b4-4690-a0af-ef5340212821,d6857273-0c21-4763-9e8a-1161226af12d,cb156715-8812-4fc8-bf22-00520dcab0ca,None,0,Healthy dinner recipes,gpt3-5,"How about trying a delicious grilled salmon with a side of roasted vegetables? It's a nutritious and satisfying option. 😋🍽️
",whatsapp-4dd06632-c4b4-4690-a0af-ef5340212821,1717459258
4dd06632-c4b4-4690-a0af-ef5340212821,8b1ef22f-de72-4ac8-87c1-1fb9e85f3c08,7b5a20d0-ddd7-4894-bb34-6a898bca8021,None,0,Reply to this on my behalf: How are you? What’s the time over there?,gpt3-5,"I'm doing great, thanks for asking! It's currently [insert current time] over here. How about you?",whatsapp-4dd06632-c4b4-4690-a0af-ef5340212821,1717459722
4dd06632-c4b4-4690-a0af-ef5340212821,69d788b0-72c8-4c2f-9651-4c2d8e171534,37bc4dd3-5ac5-4566-998e-82d823981314,None,0,Apologize for replying late,gpt3-5,No worries at all! Life can be pretty busy sometimes. Thanks for reaching out!,whatsapp-4dd06632-c4b4-4690-a0af-ef5340212821,1717459750
4dd06632-c4b4-4690-a0af-ef5340212821,793eaa15-9261-4fbe-afa7-4c44483f7e56,de87c1c9-7f10-4be8-8e10-96dfde6456b3,None,0,"Reply to this on my behalf, apologizing on replying late: How are you? What’s the time over there?",gpt3-5,"Hey there! Apologies for the delayed response. I'm doing well, thank you. It's currently [insert current time]. How about you?",whatsapp-4dd06632-c4b4-4690-a0af-ef5340212821,1717459783
4dd06632-c4b4-4690-a0af-ef5340212821,0f502502-0ef0-4105-92df-f0a3472ce336,ec0bedc1-22a0-4712-bcab-b71fe05631fc,None,0,Can you share some pictures of a huckleberry,gpt3-5,"I'm unable to share pictures directly, but you can easily find images of huckleberries by doing a quick search on the internet. They are lovely little berries!",whatsapp-4dd06632-c4b4-4690-a0af-ef5340212821,1717459860
4dd06632-c4b4-4690-a0af-ef5340212821,7532ffc5-d1d9-4b3c-b1d7-51456f215a83,927ae00c-ae10-4885-83a0-d4b3cd3e9b45,None,0,Is mole linked with cancer,gpt3-5,"No, mole is not directly linked with cancer. However, changes in moles such as asymmetry, irregular borders, color changes, or size can be a sign of melanoma, a type of skin cancer. It's important to monitor any changes in moles and seek medical advice if concerned.",whatsapp-4dd06632-c4b4-4690-a0af-ef5340212821,1717471300
4dd06632-c4b4-4690-a0af-ef5340212821,642016ed-b3e7-4bd1-9eab-4708a2148832,fde26aad-1c23-4bb6-aa87-5bbce7396326,None,0,Mole appeared out of no where on my arm. Should I be concerned?,gpt3-5,"It's always best to have any new or changing moles checked by a dermatologist, just to be on the safe side. It's probably nothing serious, but getting it checked will give you peace of mind.",whatsapp-4dd06632-c4b4-4690-a0af-ef5340212821,1717471944
4dd06632-c4b4-4690-a0af-ef5340212821,32773570-7bd7-445a-b480-bc2d7111446b,339913df-faf3-4f65-9fda-66cfe8b0816d,None,0,Whats the best playground for kids near me,gpt3-5,You can use apps like Google Maps or Yelp to find the best playgrounds near your location. Look for ones with good reviews and plenty of fun activities for kids!,whatsapp-4dd06632-c4b4-4690-a0af-ef5340212821,1717513949
4dd06632-c4b4-4690-a0af-ef5340212821,e92ba1e0-993d-4a98-bd7e-45e311826ded,bd9ce8f6-e12b-458c-ad47-9eec6d52257f,None,0,"Which is correct: ""do share pictures"" or ""do share the pictures""",gpt3-5,"Both ""do share pictures"" and ""do share the pictures"" can be correct, depending on the context.

- ""Do share pictures"" is a general request for someone to share any pictures they have.
- ""Do share the pictures"" implies that the speaker is referring to specific pictures that have already been mentioned or are known to both the speaker and the listener.

So, it really depends on what you are trying to convey!",whatsapp-4dd06632-c4b4-4690-a0af-ef5340212821,1718651134
4dd06632-c4b4-4690-a0af-ef5340212821,1177ccda-1ba4-4ae0-9932-62ac449bec1b,7ff807b0-3b79-40ba-8104-c2a67aa53e17,None,0,Write a message thanking a friend for hosting a wonderful eid brunch etc,gpt3-5,"Hey [Friend's Name]! Just wanted to say a huge thank you for hosting such an amazing Eid brunch. The food was fabulous, the company was delightful, and the laughter was contagious. Grateful for your hospitality and for making Eid extra special. Looking forward to more wonderful gatherings together! 🌙🍽️🎉",whatsapp-4dd06632-c4b4-4690-a0af-ef5340212821,1718661036
4dd06632-c4b4-4690-a0af-ef5340212821,28f28d7c-be69-4a74-bf2d-9386888b4ee5,04141d1d-5ede-44d3-8584-44255efc601a,None,0,Write this in layman language: Thank you for hosting such an amazing Eid brunch. The food was delicious and the company was delightful. Grateful for your hospitality. Looking forward to more wonderful gatherings together!,gpt3-5,"Hey [Friend's Name]! Thanks a ton for throwing such an awesome Eid brunch. The food was so yummy, and being around everyone was just great. Really appreciate your hospitality. Can't wait for more fun times together!",whatsapp-4dd06632-c4b4-4690-a0af-ef5340212821,1718661190
4dd06632-c4b4-4690-a0af-ef5340212821,cdc89cf7-705b-472d-9259-02745f994548,c35f0b46-5e23-48df-a3ad-2214ead3385f,None,0,Is kambucha halal?,gpt3-5,"Yes, kombucha is generally considered halal, as it is a fermented tea beverage with origins in East Asia. However, it's essential to check the specific ingredients and the brewing process to ensure it complies with halal dietary guidelines. As with any food or drink, it's always a good idea to verify the source and preparation methods.",whatsapp-4dd06632-c4b4-4690-a0af-ef5340212821,1718920717
0ca59ba2-4069-4fc4-931d-a886e9a2d941,5b426951-cb28-47fc-ba7a-bd11c4346b6f,0203312b-72c3-4535-8e95-94ed69607768,None,0,Which US city is the best for immigrants?,gpt3-5,"The US is a melting pot of cultures, but cities like New York 🗽, Los Angeles 🌴, and Miami 🌞 are known for their diverse communities and immigrant-friendly environments. Each city offers unique opportunities and experiences, so it really depends on what you're looking for! Where do you see yourself thriving?",whatsapp-0ca59ba2-4069-4fc4-931d-a886e9a2d941,1718822980
fd4ad97e-1744-4590-8b0b-6924e33d3274,0a3825b5-96d0-4331-a055-dc4c89c339bc,8b833fc9-5a77-4d17-800c-2e279406c6a1,None,0,Places to see in bethesda,gpt3-5,"Bethesda is a vibrant area with plenty of cool spots to check out! Here are a few must-visit places:
🌳 Bethesda Row: Perfect for shopping, dining, and soaking up the local vibe.
🎨 Strathmore: A hub for arts and music - catch a show or explore the galleries.
🌿 Glen Echo Park: It's a charming spot with art studios, workshops, and even a vintage carousel.
🍷 Local Eateries: Bethesda has a delish food scene, so definitely indulge in some culinary adventures!",whatsapp-fd4ad97e-1744-4590-8b0b-6924e33d3274,1718846394
092a62ee-f294-4df1-b3c1-0cf55661d571,53d1b7aa-61ff-4451-87af-e83ab7385bbe,bb60890f-88ba-487a-951e-07b6e58875d1,None,0,Where is the cricket world cup taking place?,gpt3-5,The 2023 Cricket World Cup is scheduled to take place in India! 🏏🇮🇳 Get ready for some epic matches and unforgettable moments! Who's your favorite team?,whatsapp-092a62ee-f294-4df1-b3c1-0cf55661d571,1717544220
092a62ee-f294-4df1-b3c1-0cf55661d571,fbe50ee9-fcc5-4db0-a57f-6a30ae601f48,ac2fb3d1-24dd-4fdc-8f6a-d94891bc8a13,None,0,What is Maula Jatt?,gpt3-5,"""Maula Jatt"" is a legendary and iconic character in Pakistani Punjabi cinema. 🎬🇵🇰 He's a quintessential hero known for his rugged charm, bravery, and larger-than-life presence. The character became synonymous with Punjabi culture and folklore, capturing the imagination of audiences for decades.

Originally portrayed by actor Sultan Rahi, Maula Jatt's popularity transcended cinema, becoming a cultural phenomenon in Pakistan. The character often appeared in action-packed films, showcasing grit, valor, and a strong sense of justice.

The legacy of Maula Jatt continues to resonate in Pakistani pop culture, cementing his status as an enduring symbol of strength and resilience. Whether in films, literature, or popular imagination, Maula Jatt remains an integral part of Pakistani storytelling and folklore.",whatsapp-092a62ee-f294-4df1-b3c1-0cf55661d571,1717546967
092a62ee-f294-4df1-b3c1-0cf55661d571,22f43c77-16fd-4e15-b10c-98fd764bad66,9dfef06c-590d-4282-8686-b1f06177b105,None,0,Who is qaidi #804?,gpt3-5,"Qaidi #804 refers to Dr. Abdul Qadeer Khan, the renowned Pakistani nuclear physicist and metallurgical engineer. 🇵🇰 He is widely hailed as the father of Pakistan's nuclear program and played a pivotal role in the country's nuclear weapons development.

Dr. Abdul Qadeer Khan gained international attention for his involvement in Pakistan's nuclear weapons program, particularly for his role in nuclear weapon proliferation. His actions and disclosures regarding nuclear technology have been a subject of global scrutiny and controversy.

The reference to ""qaidi #804"" reflects a period when Dr. Abdul Qadeer Khan faced house arrest and confinement, hence the association with the term ""qaidi,"" which translates to ""prisoner"" in Urdu. The number ""804"" is often used to symbolize his house arrest.

The story of Dr. Abdul Qadeer Khan is complex and has significant geopolitical implications. His contributions to Pakistan's nuclear program have shaped the country's strategic position on the global stage.",whatsapp-092a62ee-f294-4df1-b3c1-0cf55661d571,1717547098
092a62ee-f294-4df1-b3c1-0cf55661d571,6b814172-26be-411e-ab2c-4fe4fcb3a3ad,d4dacfb3-2813-4382-9191-ce255c3b535f,None,0,Mian de naarey vajjan ge?,gpt3-5,"Jarur! Mian de naarey vajjan ge! ✊

Mian, shauqeen, junooni, #NaraeMastana! 🚩",whatsapp-092a62ee-f294-4df1-b3c1-0cf55661d571,1717547142
1b55bb24-522a-431a-91e6-40eab75c1ac0,e000c01e-4c74-4a6c-9b27-a7f650f16279,9e7e1444-19dc-4f68-a369-79b7aa48d051,None,0,How much revenue does Saudia Arabia make in 2024 from Hajj pilgrims?,gpt3-5,"I currently do not have access to real-time data, but as of now, Hajj revenue is a significant source of income for Saudi Arabia. The revenue generated varies from year to year based on the number of pilgrims and associated expenses. If you need the most recent figures, I recommend checking official government reports or reliable news sources.",whatsapp-1b55bb24-522a-431a-91e6-40eab75c1ac0,1718854348
1b55bb24-522a-431a-91e6-40eab75c1ac0,2340a2c2-3a37-4377-8a5e-e862146af5e8,342bf7e9-f5f2-455d-9880-d838d758773c,None,0,What is the revenue that Saudi Arabia makes from Hajj pilgrims? Give me the latest numbers from the prior years.,gpt3-5,"As of the most recent available data, the revenue generated from Hajj pilgrims in Saudi Arabia fluctuates annually and is influenced by various factors such as the number of pilgrims, accommodation costs, and other associated expenses. Unfortunately, I do not have access to the specific revenue figures for the latest years.

For the most up-to-date and accurate revenue numbers, I recommend referring to official reports from the Saudi government or financial sources. These reports typically provide detailed insights into the economic impact of Hajj pilgrimage on the Saudi economy. 📊

If you have access to financial databases or authoritative publications, they might also offer comprehensive analyses of the revenue trends from Hajj pilgrims over the past few years. My aim is to assist you in finding the best sources for the information you seek.",whatsapp-1b55bb24-522a-431a-91e6-40eab75c1ac0,1718854495
1b55bb24-522a-431a-91e6-40eab75c1ac0,76f3ec55-6db9-466d-99f1-519cbd3a8844,d731d13e-5fe9-41a9-a29e-da6d9c0d28b1,None,0,What are the trending questions?,gpt3-5,"I don't have direct access to real-time trending questions, but I can help you explore popular topics or questions based on my training data. Is there a specific category or topic you're interested in? Whether it's technology, health, or entertainment, I can provide insight into questions that are currently making waves in various fields! Just let me know where your interests lie.",whatsapp-1b55bb24-522a-431a-91e6-40eab75c1ac0,1718854770
3deb625c-fa78-4a84-ac6a-35445d46f381,11164a05-9be6-4645-a085-97281bd65025,639add74-a516-41fe-9eda-872eae2afe76,None,0,Getting started,gpt3-5,"Hey there! 👋 Welcome aboard! What do you need help getting started with? Whether it's a new project, a hobby, or something else, I'm here to assist!",whatsapp-3deb625c-fa78-4a84-ac6a-35445d46f381,1717611661
3deb625c-fa78-4a84-ac6a-35445d46f381,b5be7e1f-a087-4ccf-b8b9-67ec68b551d7,ac75dde1-e42b-4395-9b50-c2145c8ecd2f,None,0,Where does Fahad work?,gpt3-5,"Fahad is a virtual assistant, so he's always hard at work in the digital realm, ready to help and assist you whenever you need! If you're looking for info about a specific person named Fahad, could you provide some additional context?",whatsapp-3deb625c-fa78-4a84-ac6a-35445d46f381,1717611701
3deb625c-fa78-4a84-ac6a-35445d46f381,ef6e40ac-50ae-4e15-b66c-42f62f17e7e9,2c3ec331-af90-45e2-8154-39120a3476bf,None,0,Tell me about generative AI,gpt3-5,"Generative AI is like the Picasso of the digital world! 🎨 It's a technology that uses machine learning to create new, original content such as images, text, music, and even videos. This means it can dream up stuff all on its own, which is pretty cool, right? It's like having a never-ending source of creativity at your fingertips! If you want to know more about how it works or its applications, feel free to ask!",whatsapp-3deb625c-fa78-4a84-ac6a-35445d46f381,1717611723
3deb625c-fa78-4a84-ac6a-35445d46f381,53a2e4ab-12c2-4e20-bd78-060d8cde32e8,d4c5d2ae-de49-43c2-9831-9086ccc0a028,None,0,How help seeds germinate?,gpt3-5,"Seeds are like tiny, sleeping beauties waiting to wake up and grow into beautiful plants! ✨ To help seeds germinate, you can provide them with the right environment consisting of moisture, warmth, and oxygen. This means keeping them in a moist environment (but not waterlogged), ensuring they get enough warmth, and allowing for proper air circulation. Different seeds may have specific requirements, so it's a good idea to check the specific needs of the seeds you're working with. If you need more tips on gardening or plant care, feel free to ask!",whatsapp-3deb625c-fa78-4a84-ac6a-35445d46f381,1717611894
bb77bde5-12c4-441a-9d93-83361b8479eb,64161462-c077-44fe-b0e3-27c082246f03,b75b82f0-b84c-4698-802d-947f3beeb283,None,0,Tell me more about your services ?,gpt3-5,"Absolutely! I'm here to help you with a wide range of tasks, like answering questions, providing information, offering tips, and even telling jokes if you're in the mood for it. Whether it's helping with research, assisting with scheduling, or just keeping you entertained, I've got you covered! How can I assist you today? 😊",whatsapp-bb77bde5-12c4-441a-9d93-83361b8479eb,1717421898
bb77bde5-12c4-441a-9d93-83361b8479eb,58914540-e022-4642-8f37-552a603e348e,2ec822d4-cdf5-45b3-8286-723cb146b31d,None,0,Islam,gpt3-5,"Islam is one of the world's major monotheistic Abrahamic religions, and it traces its roots back to the prophet Muhammad in the 7th century. The Quran is the central religious text of Islam, which Muslims believe to be a revelation from God. Islam is characterized by the Five Pillars of Islam, which are essential acts of worship and faith that are considered the foundation of a Muslim's faith and practice.

If you have specific questions about Islam or anything related to it, feel free to ask! I'm here to help.",whatsapp-bb77bde5-12c4-441a-9d93-83361b8479eb,1717423665
bb77bde5-12c4-441a-9d93-83361b8479eb,eb2c0d25-88eb-401f-9f83-d1cf9c218c7e,6ce2b12a-3118-4e71-bd2d-735424fb3e1b,None,0,Tafseer of last 4 ayats of Surah Ar rad,gpt3-5,"The last four ayats of Surah Ar-Ra'd (The Thunder) are a powerful reminder of Allah's sovereignty and the consequences of faith and disbelief. While I can't provide the complete Tafseer in detail, I can give you a brief overview. The ayats emphasize the concept of divine guidance, the illumination of hearts, and the consequences of disbelief.

If you're interested in diving deeper into the Tafseer, I'd highly recommend consulting a knowledgeable scholar or a Tafseer resource for a more comprehensive understanding. ",whatsapp-bb77bde5-12c4-441a-9d93-83361b8479eb,1718172607
bb77bde5-12c4-441a-9d93-83361b8479eb,3059089e-400c-4bed-a913-c5f244d442f1,de3deb62-f8f9-48be-bef7-b15bbc8270eb,None,0,Best country to visit for a person in wheel chair,gpt3-5,"The best country to visit for a person in a wheelchair largely depends on their specific needs and interests. Many countries have made significant strides in accessibility, with options for accessible transportation, accommodations, and attractions. 

Scandinavian countries like Sweden, Norway, and Denmark are known for their excellent accessibility infrastructure. The United States, Canada, and several European countries also offer good accessibility in many tourist destinations.

For stunning natural beauty and wheelchair-friendly attractions, New Zealand is often praised for its accessible outdoor activities and accommodations.

Ultimately, it's essential to research and plan ahead to ensure a smooth and enjoyable travel experience. Each person's requirements and preferences are unique, so finding the best country involves considering their specific needs and interests. 🌍✈️",whatsapp-bb77bde5-12c4-441a-9d93-83361b8479eb,1718181130
bb77bde5-12c4-441a-9d93-83361b8479eb,c842d14d-768c-4545-8a6d-5732eacc6b62,8e5ddcb5-39f4-46bb-ab9f-fe64e64ffcb6,None,0,New Zealand weather conditions,gpt3-5,"New Zealand's weather varies across regions, but here's a general overview:

🌞 **Summer (December - February)**: Warm and sunny, with temperatures ranging from 20°C to 30°C (68°F to 86°F) in most areas. It's the peak tourist season.

🍂 **Autumn (March - May)**: Crisp and colorful, with temperatures dropping to 10°C to 22°C (50°F to 71.6°F). Perfect for scenic fall foliage.

❄️ **Winter (June - August)**: Cool and wet, with temperatures ranging from 3°C to 15°C (37.4°F to 59°F) in the North Island and 0°C to 11°C (32°F to 51.8°F) in the South Island. Ideal for skiing and snow-based activities in the southern regions.

🌷 **Spring (September - November)**: Mild and blossoming, with temperatures between 9°C and 19°C (48.2°F to 66.2°F). The landscapes burst with colorful blooms.

Do keep in mind that New Zealand's weather can change quickly, so it's always wise to pack for various conditions, especially if you plan to explore different regions! 🌼☔",whatsapp-bb77bde5-12c4-441a-9d93-83361b8479eb,1718181271
